{
  "$schema": "https://json-schema.org/draft/2020-12/schema",
  "$id": "https://github.com/num1hub/capsule-specs/schemas/public-limitations-register.schema.json",
  "title": "Public Limitations Register",
  "type": "object",
  "additionalProperties": false,
  "required": [
    "version",
    "reviewed_at",
    "limitations",
    "non_claims",
    "review_commands"
  ],
  "properties": {
    "version": {
      "type": "string"
    },
    "reviewed_at": {
      "type": "string"
    },
    "limitations": {
      "type": "array",
      "minItems": 4,
      "items": {
        "type": "object",
        "additionalProperties": false,
        "required": [
          "id",
          "class",
          "summary",
          "impact",
          "strongest_surfaces",
          "verify_commands"
        ],
        "properties": {
          "id": {
            "type": "string"
          },
          "class": {
            "type": "string"
          },
          "summary": {
            "type": "string"
          },
          "impact": {
            "type": "string"
          },
          "strongest_surfaces": {
            "type": "array",
            "minItems": 1,
            "items": {
              "type": "string"
            }
          },
          "verify_commands": {
            "type": "array",
            "minItems": 1,
            "items": {
              "type": "string"
            }
          }
        }
      }
    },
    "non_claims": {
      "type": "array",
      "minItems": 2,
      "items": {
        "type": "string"
      }
    },
    "review_commands": {
      "type": "array",
      "minItems": 1,
      "items": {
        "type": "string"
      }
    }
  }
}
